{
  "event_id": "01J9Z3K7Q8shipmentupda",
  "event_type": "shipment.updated",
  "schema_version": 1,
  "occurred_at": "2026-09-29T08:15:02Z",
  "tsf_shop_id": "shop_45021",
  "aggregate_id": "shp_01",
  "aggregate_version": 1,
  "data": {
    "order_id": "TSF-240929-000123",
    "status": "SHIPPED",
    "carrier": "FLASH",
    "tracking_no": "TH0123456789A",
    "shipped_at": "2026-09-30T03:20:00Z"
  }
}
