{
  "event_id": "01J9Z3K7Q8orderupdated-recipient",
  "event_type": "order.updated",
  "schema_version": 1,
  "occurred_at": "2026-09-29T08:20:02Z",
  "tsf_shop_id": "shop_45021",
  "aggregate_id": "TSF-240929-000123",
  "aggregate_version": 3,
  "data": {
    "order_id": "TSF-240929-000123",
    "recipient": {
      "name": "Updated Name",
      "phone": "+66812345678",
      "address": {
        "line1": "99 New Road",
        "district": "Pathum Wan",
        "province": "Bangkok",
        "postcode": "10330"
      }
    }
  }
}
