{
  "event_id": "01J9Z3K7Q8shipmentstat",
  "event_type": "shipment.status_changed",
  "schema_version": 1,
  "occurred_at": "2026-09-29T08:15:02Z",
  "tsf_shop_id": "shop_45021",
  "aggregate_id": "TSF-240929-000123",
  "aggregate_version": 6,
  "data": {
    "order_id": "TSF-240929-000123",
    "status": "DELIVERED",
    "tracking_no": "TH0123456789A"
  }
}
