{
  "event_id": "01J9MEMBERSHIPCHANGED0001",
  "event_type": "membership.changed",
  "schema_version": 1,
  "occurred_at": "2026-09-29T08:15:02Z",
  "tsf_shop_id": "shop_45021",
  "aggregate_id": "shop_45021",
  "aggregate_version": 7,
  "data": {
    "name": "Active Shop",
    "tier": "PRO",
    "status": "ACTIVE",
    "ent_ver": 7,
    "expires_at": "2026-12-31T16:59:59Z"
  }
}
